{
  "$schema": "./revision-resolution-candidates-v1.schema.json",
  "schema_version": "1.0.0",
  "artifact_type": "P0_REVISION_RESOLUTION_CANDIDATE_SET",
  "artifact_id": "INTERP-DIALOGUE-001P0-V1-RESOLUTION-CANDIDATES",
  "source_proposal_set_binding": {
    "artifact_id": "INTERP-DIALOGUE-001P1-V0-REVISION-PROPOSALS",
    "path": "research/scenarios/interp-dialogue-001/elicitation/p1/proposals/instrument-revision-proposals-v0.json",
    "content_sha256": "5c1225d90bb7483102fdb29ffd8da129f11c9f300cdac625d080edc1937248b1"
  },
  "source_adjudication_binding": {
    "artifact_id": "INTERP-DIALOGUE-001P1-V0-DEFECT-ADJUDICATION",
    "path": "research/scenarios/interp-dialogue-001/elicitation/p1/assessment/analyst-adjudication-v0.json",
    "content_sha256": "8a85d0a5702d99258bfcd44df779d34c40bdd830660f3cc03230c3a900192b9b"
  },
  "canonicalization_profile_id": "HM-CANONICAL-JSON-PY-V1",
  "revision_basis_digest_domain": "HM-REVISION-BASIS-JSON-V1",
  "authority": "CANDIDATES_ONLY_DECISIONS_ARE_SEPARATE",
  "candidates": [
    {
      "resolution_candidate_id": "RC-RP001-REL",
      "source_proposal_id": "RP-001",
      "source_defect_receipt_ids": [
        "DR-001"
      ],
      "semantic_change_classification": "REFERENT_CLARIFICATION",
      "operations": [
        {
          "operation_id": "OP-RC-RP001-REL-01",
          "operation_kind": "ADD_SURFACE_REALIZATION",
          "basis_refs": [
            {
              "artifact_id": "INTERP-DIALOGUE-001P0-ELICITATION-INSTRUMENT-V0",
              "artifact_path": "research/scenarios/interp-dialogue-001/elicitation/instrument-v0.json",
              "artifact_sha256": "52705bc686a69d43360eb0544eda59571c77dc1e29520ec4b156bcd60f413776",
              "json_pointer": "/prompt_catalog/0/participant_text",
              "value_canonical_sha256": "c0acb64a486d728e411768e8d3d0a16ea4dbf4b27f9624561c93b2746734c256",
              "canonicalization_profile_id": "HM-CANONICAL-JSON-PY-V1",
              "digest_domain": "HM-REVISION-BASIS-JSON-V1"
            }
          ],
          "destination": {
            "artifact_id": "PARTICIPANT-SURFACE-V1",
            "json_pointer": "/prompt_surfaces/0/participant_text",
            "precondition": "MUST_BE_ABSENT"
          },
          "replacement_value": "What is the first thing the recipient would say or do next? Respond freely; there is no single correct answer."
        },
        {
          "operation_id": "OP-RC-RP001-REL-02",
          "operation_kind": "ADD_SURFACE_REALIZATION",
          "basis_refs": [
            {
              "artifact_id": "INTERP-DIALOGUE-001P0-ELICITATION-INSTRUMENT-V0",
              "artifact_path": "research/scenarios/interp-dialogue-001/elicitation/instrument-v0.json",
              "artifact_sha256": "52705bc686a69d43360eb0544eda59571c77dc1e29520ec4b156bcd60f413776",
              "json_pointer": "/prompt_catalog/1/participant_text",
              "value_canonical_sha256": "6bd2519c91833e61e4c8f086aa21bce45e70f246de99002ad6262a17572fcdb1",
              "canonicalization_profile_id": "HM-CANONICAL-JSON-PY-V1",
              "digest_domain": "HM-REVISION-BASIS-JSON-V1"
            }
          ],
          "destination": {
            "artifact_id": "PARTICIPANT-SURFACE-V1",
            "json_pointer": "/prompt_surfaces/1/participant_text",
            "precondition": "MUST_BE_ABSENT"
          },
          "replacement_value": "After this additional event, what is the next thing the recipient would say or do? Respond freely; there is no single correct answer."
        }
      ],
      "rationale": "Adopt the exact closed-world surface realization while preserving the frozen semantic artifact as an immutable basis; any declared semantic preservation remains subject to P1-v1 inspection.",
      "authority": "EXACT_REVISION_CANDIDATE_ONLY_NO_ADOPTION_AUTHORITY"
    },
    {
      "resolution_candidate_id": "RC-RP001-WORK",
      "source_proposal_id": "RP-001",
      "source_defect_receipt_ids": [
        "DR-001"
      ],
      "semantic_change_classification": "REFERENT_CLARIFICATION",
      "operations": [
        {
          "operation_id": "OP-RC-RP001-WORK-01",
          "operation_kind": "ADD_SURFACE_REALIZATION",
          "basis_refs": [
            {
              "artifact_id": "INTERP-DIALOGUE-001P0-ELICITATION-INSTRUMENT-V0",
              "artifact_path": "research/scenarios/interp-dialogue-001/elicitation/instrument-v0.json",
              "artifact_sha256": "52705bc686a69d43360eb0544eda59571c77dc1e29520ec4b156bcd60f413776",
              "json_pointer": "/prompt_catalog/0/participant_text",
              "value_canonical_sha256": "c0acb64a486d728e411768e8d3d0a16ea4dbf4b27f9624561c93b2746734c256",
              "canonicalization_profile_id": "HM-CANONICAL-JSON-PY-V1",
              "digest_domain": "HM-REVISION-BASIS-JSON-V1"
            }
          ],
          "destination": {
            "artifact_id": "PARTICIPANT-SURFACE-V1",
            "json_pointer": "/prompt_surfaces/2/participant_text",
            "precondition": "MUST_BE_ABSENT"
          },
          "replacement_value": "What is the first thing the recipient would say or do next? Respond freely; there is no single correct answer."
        },
        {
          "operation_id": "OP-RC-RP001-WORK-02",
          "operation_kind": "ADD_SURFACE_REALIZATION",
          "basis_refs": [
            {
              "artifact_id": "INTERP-DIALOGUE-001P0-ELICITATION-INSTRUMENT-V0",
              "artifact_path": "research/scenarios/interp-dialogue-001/elicitation/instrument-v0.json",
              "artifact_sha256": "52705bc686a69d43360eb0544eda59571c77dc1e29520ec4b156bcd60f413776",
              "json_pointer": "/prompt_catalog/1/participant_text",
              "value_canonical_sha256": "6bd2519c91833e61e4c8f086aa21bce45e70f246de99002ad6262a17572fcdb1",
              "canonicalization_profile_id": "HM-CANONICAL-JSON-PY-V1",
              "digest_domain": "HM-REVISION-BASIS-JSON-V1"
            }
          ],
          "destination": {
            "artifact_id": "PARTICIPANT-SURFACE-V1",
            "json_pointer": "/prompt_surfaces/3/participant_text",
            "precondition": "MUST_BE_ABSENT"
          },
          "replacement_value": "After this additional event, what is the next thing the recipient would say or do? Respond freely; there is no single correct answer."
        }
      ],
      "rationale": "Adopt the exact closed-world surface realization while preserving the frozen semantic artifact as an immutable basis; any declared semantic preservation remains subject to P1-v1 inspection.",
      "authority": "EXACT_REVISION_CANDIDATE_ONLY_NO_ADOPTION_AUTHORITY"
    },
    {
      "resolution_candidate_id": "RC-RP001-RISK",
      "source_proposal_id": "RP-001",
      "source_defect_receipt_ids": [
        "DR-001"
      ],
      "semantic_change_classification": "REFERENT_CLARIFICATION",
      "operations": [
        {
          "operation_id": "OP-RC-RP001-RISK-01",
          "operation_kind": "ADD_SURFACE_REALIZATION",
          "basis_refs": [
            {
              "artifact_id": "INTERP-DIALOGUE-001P0-ELICITATION-INSTRUMENT-V0",
              "artifact_path": "research/scenarios/interp-dialogue-001/elicitation/instrument-v0.json",
              "artifact_sha256": "52705bc686a69d43360eb0544eda59571c77dc1e29520ec4b156bcd60f413776",
              "json_pointer": "/prompt_catalog/0/participant_text",
              "value_canonical_sha256": "c0acb64a486d728e411768e8d3d0a16ea4dbf4b27f9624561c93b2746734c256",
              "canonicalization_profile_id": "HM-CANONICAL-JSON-PY-V1",
              "digest_domain": "HM-REVISION-BASIS-JSON-V1"
            }
          ],
          "destination": {
            "artifact_id": "PARTICIPANT-SURFACE-V1",
            "json_pointer": "/prompt_surfaces/4/participant_text",
            "precondition": "MUST_BE_ABSENT"
          },
          "replacement_value": "What is the first thing the walker would say or do next? Respond freely; there is no single correct answer."
        },
        {
          "operation_id": "OP-RC-RP001-RISK-02",
          "operation_kind": "ADD_SURFACE_REALIZATION",
          "basis_refs": [
            {
              "artifact_id": "INTERP-DIALOGUE-001P0-ELICITATION-INSTRUMENT-V0",
              "artifact_path": "research/scenarios/interp-dialogue-001/elicitation/instrument-v0.json",
              "artifact_sha256": "52705bc686a69d43360eb0544eda59571c77dc1e29520ec4b156bcd60f413776",
              "json_pointer": "/prompt_catalog/1/participant_text",
              "value_canonical_sha256": "6bd2519c91833e61e4c8f086aa21bce45e70f246de99002ad6262a17572fcdb1",
              "canonicalization_profile_id": "HM-CANONICAL-JSON-PY-V1",
              "digest_domain": "HM-REVISION-BASIS-JSON-V1"
            }
          ],
          "destination": {
            "artifact_id": "PARTICIPANT-SURFACE-V1",
            "json_pointer": "/prompt_surfaces/5/participant_text",
            "precondition": "MUST_BE_ABSENT"
          },
          "replacement_value": "After this additional event, what is the next thing the walker would say or do? Respond freely; there is no single correct answer."
        }
      ],
      "rationale": "Adopt the exact closed-world surface realization while preserving the frozen semantic artifact as an immutable basis; any declared semantic preservation remains subject to P1-v1 inspection.",
      "authority": "EXACT_REVISION_CANDIDATE_ONLY_NO_ADOPTION_AUTHORITY"
    },
    {
      "resolution_candidate_id": "RC-RP002-PARTNER",
      "source_proposal_id": "RP-002",
      "source_defect_receipt_ids": [
        "DR-002"
      ],
      "semantic_change_classification": "REFERENT_CLARIFICATION",
      "operations": [
        {
          "operation_id": "OP-RC-RP002-PARTNER-01",
          "operation_kind": "ADD_SURFACE_REALIZATION",
          "basis_refs": [
            {